{
  "version": 1,
  "format": "oneecma.report",
  "summary": {
    "errors": 1,
    "warnings": 0,
    "repairs": 0
  },
  "diagnostics": [
    {
      "kind": "SyntaxError",
      "code": "invalid-token",
      "severity": "error",
      "headline": "Invalid or unexpected token",
      "source": {
        "name": "case.js",
        "length": 56
      },
      "span": {
        "start": 12,
        "end": 23,
        "line": 1,
        "column": 13,
        "endLine": 1,
        "endColumn": 24
      },
      "label": "a string literal cannot contain a line break",
      "secondary": [],
      "notes": [
        "not repaired automatically: both fixes give a different string than a reader might expect"
      ],
      "help": [
        "write the break as `\\n` inside the string, or use a template literal with backticks"
      ],
      "fixes": [
        {
          "description": "write the line break as `\\n`",
          "edits": [
            {
              "start": 23,
              "length": 1,
              "line": 1,
              "column": 24,
              "text": "\\n"
            }
          ]
        },
        {
          "description": "use a template literal",
          "edits": [
            {
              "start": 12,
              "length": 1,
              "line": 1,
              "column": 13,
              "text": "`"
            },
            {
              "start": 35,
              "length": 1,
              "line": 2,
              "column": 12,
              "text": "`"
            }
          ]
        }
      ],
      "recovery": []
    }
  ]
}
