{
  "version": 1,
  "format": "oneecma.report",
  "summary": {
    "errors": 1,
    "warnings": 0,
    "repairs": 0
  },
  "diagnostics": [
    {
      "kind": "SyntaxError",
      "code": "unexpected-token",
      "severity": "error",
      "headline": "Unexpected token ','",
      "source": {
        "name": "case.js",
        "length": 63
      },
      "span": {
        "start": 37,
        "end": 38,
        "line": 2,
        "column": 22,
        "endLine": 2,
        "endColumn": 23
      },
      "label": "class members are not separated by commas",
      "secondary": [],
      "notes": [],
      "help": [
        "remove the `,`"
      ],
      "fixes": [],
      "recovery": []
    }
  ]
}
